text,label
"Blue Mountain State S01
Collegeserie med ekstrem seksuell driv. 

Den amerikanske tv-kanalen Spikes collegeserie handler om fotballspillerne på skolen Blue Mountain States lag The Goats. 

Men aller mest om festing og puling. 

...jeg vil gjerne SE pupper og ståkuker 

Fotballidioter 

Fotball må her forstås som amerikansk fotball, og Blue Mountain State handler mye om regler og tradisjoner og denslags innenfor fotballmiljøet. 
Serien gikk på MTV i fjor, og sesong to er i gang i USA. 

The Goats er et brorskap av større eller mindre fotballidioter og de er omringet av damer som slåss om å ligge med fotballspillere. 

Omgivelsene i Blue Mountain State består av høy musikk, trange kollektiver og plastbeger og serien følger quarterbacken og slackeren Alex Moran (Darin Brooks), Sammy Cacciatore (Chris ""Romanski"" Romano) og Craig Shilo (Sam Jones III) på daglige collegeeventyr hvor en sugejobb kan redde dagen. 

Seksuelt frustrert 

Den mest utagerende delen av collegekulturen i USA skildres i Blue Mountain State: øl og sex er selve navet i serien og utenpå der igjen kommer sniffing og røyking av sentralstimulerende saker og epidemier av kjønnssykdommer. 

Serien er proppfull av sex og hud men viser det ikke direkte, bare på den aksepterte amerikanske antydende måten. 
Jeg kunne faktisk tenkt meg mer enn bare nakne rygger og store utringninger, jeg vil gjerne SE pupper og ståkuker. 
Ikke bare høre snakk om det hele tida. 

I så måte er Blue Mountain State en seksuelt frustrert serie. 
Eller den erter meg bare, og feiger ut når den skal prøve å være drøy. 

Nusja - en sentral aktør 

Til tider er Blue Mountain State riktig artig, jeg digger situasjonene som ikke er overdrevet, bare skrevet veldig bra og underspilt på den riktige måten. 

Serien skal dessuten ha skryt for originale collegevinklinger, som for eksempel den store jakten på den forsvunne lommenusja fra Bosnia, de ville runkehistoriene og ringen som forsvinner opp i nusja på en stripper. 

Skuespillerprestasjonene er i beste fall middels, og så mye mer enn det trenger en heller ikke å prestere for å spille karikerte ungdommer (jeg husker for eksempel ikke American Pie for de fantastiske rolletolkningene). 

Skuespiller og regissør Romanski har gitt seg selv den kuleste rollen. 
Han ser og høres ut som en ung Rick Moranis og har noen øyeblikk som er hysteriske. 

En annen som skiller seg ut er Thad Castle (Alan Ritchson), kapteinen på laget og en megaloman hormon-Godzilla som shotter alt som flyter og røyker alt som ryker: tenk Stiffler krysset med den gærne militærsjefen i Avatar. 

For å sette strek: 
Blue Mountain State er tålelig bra på en hjernedød dag, men kunne godt dratt på enda mer. 
",1
"Treme S01
Optimisme og kamp i en rimelig rasert by 

Det knyttet seg ikke rent lite spenning til David Simons neste prosjekt når han var ferdig med The Wire. 
I flere år hadde situasjonen for politiet, røverne og omtrent alle derimellom i Baltimore blitt skildret, og Baltimore hadde fått sin grundige hyllest. 

Denne evnen til å fange en hel by i serieform skulle Simon perfeksjonere ytterligere med Treme. 

Det finnes øyeblikk her som er helt hakeslipp. 

En rasert by 

For Treme er, som du kanskje allerede har hørt, en hyllest til New Orleans. 
Og slik tilfellet var med The Wire og Baltimore (og The Corner og Baltimore også, for den del), ble Treme spilt inn i New Orleans. 
Forskjellen mellom disse to byene er at Baltimore har sine storbyproblemer som så mange andre, mens New Orleans er så sterkt medtatt av orkanen Katarinas herjing at det mangler sidestykke i den utviklede verden i moderne tid. 

Og Treme handler om optimismen og kampen i denne rimelig raserte byen. 
En ekte by. 
En levende kulisse. 

Gir musikken sin fortjente plass 

For det første er Simons siste mesterverk overraskende. 
Det finnes enkelte øyeblikk her som er helt hakeslipp. 
I første episode kan jeg bare trekke fram det gledelige gjensynet med Clarke Peters som Albert Lambreaux, i full Mardi Gras-drakt. 
Himmel og hav. 
Jeg tror ikke jeg blunket under hele seansen. 

Musikken jeg hører i serien spilles som regel der og da, eller over et anlegg i rommet. 

Et annet overraskende element ved Treme er at musikken i seg selv til tider er nok; rett som det er bærer musikken hele sekvenser alene. 
Uten dialog. 

Jeg har aldri sett en serie tørre å la musikken tale så for seg så mye som Treme, og det elsker jeg den for. 

David Simons talent for dialog 

Dialogen er så naturlig og flyter så godt at det er vanskelig å si noe mer om den. 
Like vanskelig som det er å si noe om dialogen vi har med vennene våre. 

Figurene er fine, både de fiktive figurene og de ekte. 
David Simons kanskje fremste trekk som serieskaper er den naturlige dialogen, og i Treme har han plukket med seg noen skuespillerveteraner fra The Wire, noen som utelukkende har jobbet med film tidligere, og lokale orleaniere som bare er seg selv. 

En troverdig blanding, selv om et par figurer blir litt flate i den store sammenhengen. 

Fellesløft for cajunenes hovedstad 

Ensemblet er stort, og hovedpersonene består i en proff trombonist som sakte men sikkert må bygge opp igjen levebrødet sitt, den engasjerte men notorisk distre dj-en, indianerhøvdingen, den sinte youtubeaktivisten, det trasige musikerparet, den strevende mesterkokken og bareieren som leter etter broren sin. 

Et utvidet ensemble som til sammen får vist frem den spesielle og kriserammede byen fra sine mange sider. 

Beste kjønnsnøytrale hovedrolle: 
New Orleans! 

New Orleans må også nevnes sammen med ensemblet, for byen i seg selv har virkelig en hovedrolle. 
Byens vesen er merkbart gjennom skjermen, og fyller stua i de seksti minuttene det varer. 

Og for en sterk avslutning! 
Sorgen, gleden og fargene! 
Du bør, for ditt eget tv-seriehjertes skyld, ikke gå glipp av denne perlen. 

(PS: 
Sesong 2 av Treme hadde premiere 24.april på HBO i USA) 
",1
"True Blood S03
Sump-operaen sparer på kruttet 

Sesong to av True Blood endte med at et minimum av ro og orden ble gjenopprettet i Bon Temps. 
For alle andre enn mitt tidligere favorittpar på lerretet Bill og Sookie: 
Bill er borte, tatt vekk fra Sookie idét hun måtte en tur på badet for å fordøye frieriet fra Bill. 
Så spenningskurven stod jo litt bratt. 

Midtpunktet Sookie er blitt en bifigur. 

Varulver 

Etterhvert kom promobildene fra sesong tre, og jeg forstod at det var noe enda mer dyrisk enn vampyrer inne i bildet. 
Varulver. 
Selvfølgelig. 
Jeg leser dessverre ikke bøkene til Charlaine Harris, men søstera mi gjør det, og hun holder spoilers for seg selv. 
Derfor vet jeg aldri hva jeg kan vente meg av True Blood, og sesong tre overrasket meg ved å gjøre meg mer kjent med figurer jeg trodde jeg kjente godt nok fra før. 

Flere historier som gløder ujevnt 

True Blood følger flere historier samtidig i sesong tre, og de store, svartøyde møljeknullene som sesong to brukte i overkant mye tid på, er borte. 
Nå er figurene jevnt fordelt på flere historier. 
Et knallbra valg. 
Men ikke alle historiene er engasjerende. 

I det hele tatt er sesong tre i sumpen en tettere visitt hos figurer jeg kjenner fra før enn et møte med nye. 
Kjipt er det da å måtte melde at Bill er blitt uinteressant, Tara livstrøtt og Sookie skjøvet til siden. 
Sookie, som var hele seriens midtpunkt når jeg først ble med inn i Louisiana, er blitt en bifigur. 

Sookie spesial 

Den opprinnelige stjernetrioen Bill, Sookie og Eric har blitt omgitt av så mye maktkamp at oversikten min for lengst har tatt hatten og gått. 
Poenget er at vampyrdronninger og varulvkonger spiller ut sine kort i hytt og gevær mens undersåttene følger sin egen agenda, og en sjelden gang iblant kuliminerer det i at Sookie må ta frem spesialkreftene og sette alle skapene på plass. 

- og hva er egentlig Sookie? 
Hun har jo krefter, det har jeg sett. 
Men hvorfor har hun disse kreftene? 
Det fikk jeg endelig svaret på i sesong tre. 
Svaret er noe jeg selv aldri hadde tenkt på, og det er kanskje da jeg koser meg mest. 
Men overnaturlige krefter til tross, det er det ekstremt uredde og fandenivoldske ved Sookie som styrer skuta. 

Flere krefter kommer til 

Jason er langt på vei den herlige asfaltcowboyen han var i førstesesongen. 
Etter å ha lefla med religiøs fanatisme i toeren blir han tatt inn i varmen av Andy, og disse to teamer opp som sheriffkontorets Klabb og Babb i treeren. 
Men Jason viser også sin kanskje beste side hittil, i møte med en frøken fra skogen. 
LaFayette skal gjennom litt av hvert, men ikke overraskende skal han bevege seg hakket lengre inn i det okkulte i møte med en kjekk sykepleier. 
Dessuten skal Arlene inn i et slags Rosemary's Baby-opplegg mens Tara bare skyver i motbakke etter Eggs' død. 

I sesong to sa Sams adoptivmor at Sams familie var ""bad people"", og hvorfor får jeg et grundig svar på i sesong tre. 
Sams historie er ett av flere fokus i sesong tre, og Sam blir en figur jeg kan forholde meg til på en helt annen måte. 
Sams møte med familien lar meg møte Sam, om jeg kan si det slik. 
Og den gjengen der kreves det litt å møte. 

En utvidet serieopplevelse 

Ekstramaterialet på Blu-rayen består av fire enhanced viewing-episoder, som sparer meg for mange turer på wiki. 
Helt enkelt betyr enhanced viewing at det dukker opp... 

...tilbud på skjermen underveis i episoden som sier at jeg kan velge å se tilbakeblikk for å friske opp hukommelsen min. 
Rett tilbake til episoden etterpå. 

...små videoruter nederst i høyre hjørne hvor en av rollefigurene forklarer situasjonen sett fra sitt ståsted. 
Mens den øvrige lyden tones ned, selvfølgelig. 
Alle disse minivideoene kan jeg også se for seg under ekstratittelen 'Character perspective'. 

...bokser med tekst om ditt og datt som bare blir uinteressant sammenlignet med videomaterialet. 

'Postmortem'-sekvensen er en ørliten dokumentar om ulvene og ulvetrenerene, og er egentlig bare er en ekstremt trimmet versjon av dokumentaren 'Anatomy of a scene', som er en grundig innføring i CGI- og ulvearbeidet som gjøres før en episode som Bad Blood er ferdig. 

I tillegg kommer to episoder med kommentarspor, Snoop Doggs ""Oh Sookie""-video og 'True Blood Lines', en interaktiv meny hvor jeg kan surfe rundt og lese om alle vesenene i True Blood og hvem som er reltatert til hvem. 

Sum: 
Forseggjort ekstramateriale uten det store marsipanlokket. 

Såpeoperaens utskjelte verdi 

Det introduseres også nye figurer i sesong tre, men de færreste av disse føles viktige. 
Sesong tre gjør fortsatt greia si riktig, og jeg koser meg med det jeg ser. 

Alt er ikke helt på plass for at jeg kan si meg maksimalt fornøyd, men det trenger det heller ikke være i annen såpeopera. 
True Blood skiller seg ikke fra de andre storhetene i sjangeren når det kommer til å melke kua fra episode til episode uten å egentlig avsløre eller avslutte noe. 

Poenget er at jeg ikke kaster bort tiden min på sesong tre, Bon Temps er jo et sted jeg bare liker å være! 

True Blood leverer fortsatt min ukentlige gotiske virkelighetsflukt, og er fortsatt sexy selv om det har blitt mindre sex. 

True Blood sesong tre er ute på dvd og Blu-ray 25.5.2011. 
",1
"South Park S13
Anbefales for for deg som ikke er en nærtagende disneyelskende jødisk hvalaktivist. 

Sesong 13, det ulykksalige tallet, byr blant annet på Michael Jackson i ei lita jentes kropp, den kjente historien om den vesle jøden som ødelegger det perfekte samfunnet på ny og f***efis sidestilt med rompefis. 

Disney, legemliggjort ved en psykopatisk Mikke Mus, får på pukkelen for sin bruk av Jonas Brothers som seksuell appell rettet mot mindreåringe og Paul Watson og resten av hvalaktivistene får en hard neve rett i juvelene. 

Trey Parker og Matt Stone balanserer hårfint mellom friske perspektiver på dagsaktuelle fenomener og aggressive, hånende og usmakelige angrep på enkeltpersoner og grupper. 

Sterkt på smak 

South Park-episodene begynner som regel med en bagatellmessig problemstilling som tar av og drar på med full gass rett inn i en ny og større sammenheng. 
Parker og Stone skrur det hele godt sammen, og hvis jeg bare ser på håndverket er det svært smakfullt gjort. 
Virkemidlene kan ved første oppleves som usmakelige, men nei: 
South Park er ikke usmakelig. 
South Park er bare sterkt på smak. 

Et speil på galskapen 

Ta sisteepisoden Pee, for eksempel. 
For å gjøre en lang historie kort, har en bølge av urin oversvømt en fornøyelselspark og for å bevise at piss gjør folk aggressive, binder myndighetene fast ei ape i lenker og pisser den i fjeset. 
Den klikker selvfølgelig, piss gjør forsøksapen forbanna, case closed og apen må skytes. 
Slik holder Parker og Stone på, og isolert høres det jævlig og overdrevent ut. 

Men i den større sammenhengen er dette bare et speil på hva som har foregått i vitenskapens og religionens navn i flere hundre år, og det skjer fortsatt. 

Og Parker og Stone er blant de få som sparker skikkelig hardt mot idiotien uten å bli surpomper. 
De lager tvert imot hysterisk artige 22-minuttere av det. 

W.T.F 

WWE-episoden er også helt hysterisk, og her settes all jugingen og skrytingen i WWE på spissen. 
Hva er egentlig premisset for wrestlig? 
Hva er greia med alle bakgrunnshistoriene? 

Er wrestling egentlig noe annet, noe langt mer finkulturelt bare i en glorete og harry innpakning? 

Og hva skjer når kampen for og imot hvalfangst koker ned til kampen om seertall for Whale Watch og Deadliest Catch? 
HER ligger Parker og Stones virkelige muskler: disse to har bransjens skarpeste blikk for satire. 

Jevnt sterkt, noen flate baller 

Det er få som makter å gi så herlig og treffende spark i ballesekken som South Park. 
Enkelte episoder er bare en fryd og en fornøyelse fordi de inneholder nok typer som politibetjent Yates i episode 9, Butter's Bottom Bitch og motorsykkelgjengen i episode 10, The F Word. 

Andre episoder, som nevnte Pee, Dances with Smurfs og Dead Celebrities, er bare slappe pasninger i forhold til resten og trekker helheten i sesong 13 ned. 
Men det er en klar femmer, dette her. 

South Park handler alltid om noe større og viktigere, og samtidig er det SINNSSYKT underholdende (for å bruke et utskjelt ord på den rette måten). 

Serien peker på samfunnets sinnsykdommer og tar rollen som narr på alvor med animasjonens kraft. 

South Park sesong 13 er i salg fra 23.februar. 
",1
"Mad Men S04
Don Draper forfaller med stil! 

Blu-ray/DVD: Mad Men er fremdeles tidens stiligste serie. 
I sesong 4 er handlingen lagt til 1965. 

JFK og Malcolm X er skutt, Vietnamkrigen er i anmarsj og både USA og reklamebyrået Sterling Cooper Draper Pryce har for lengst mistet uskylden. 

Det tidligere så glamorøse arbeidslivet på Manhattan har for alvor begynt å sette sine spor, selv på stødigheten selv, den kreative sjefen Don Draper (Jon Hamm). 

LES OGSÅ: 
Anmeldelsene av Mad Men sesong 1, sesong 2 og sesong 3. 

Med blanke ark 

Reklamebyrået har startet med blanke ark etter de dramatiske begivenhetene i slutten av sesong 3. 
Nye lokaler, nye kunder og noen nye fjes i staben. 

Men hovedpersonene er med, og vi ser hvordan de strever med å få Sterling Cooper Draper Pryce på beina økonomisk. 

På privatfronten opplever flere forandringer, både til det bedre og verre. 
Den nye tiden begynner å feste seg. 

Synlige feil og mangler 

Hver episode er en fest. 
Hvert bilde er kunst. 
Hvert møte med Don Draper en høytidsstund. 

Jeg beundrer fremdeles hans urokkelige stil og maskulinitet, samtidig som hans feil og mangler blir stadig mer synlige. 
I sesong 4 ser vi hvordan livet som nyskilt fortoner seg som en eneste stor fest, men er samtidig alt annet. 

For første gang ser vi tydelige tegn på at Don Draper er i forfall. 
Vi ser det bare på den lille vippen i den ellers så perfekt glattsleika panneluggen, at ikke alt er som det skal være. 
Forandringen i tilværelsen preger Don Draper. 

Han blir til og med bakfull av det evige alkoholforbruket! 

Sterkere kvinnestemmer 

En gjennomgående kvalitet i alle sesongene er de fantastiske kulissene. 
Stilen er upåklagelig, og tidsånden kommuniseres også med små referanser til strømninger og historiske begivenheter i 1965-samfunnet. 

I sesong 4 ser vi blant annet hvordan kvinnestemmene blir stadig sterkere. 

Mens Peggy Olson (Elisabeth Moss) måtte kjempe for sin plass blant mannlige kollegaer i sesong 1, ser vi nå at flere kvinner setter sitt preg på arbeidslivet i byrået. 

Mer Mad Men i vente 

Begivenhetene i sesong 4 rev meg kanskje ikke like mye med som sesong 3 gjorde. 

Men det endrer ikke det faktum at Mad Men stadig vekk er noe av det bedre jeg putter inn i Blu-ray-spilleren min. 

Dette er en ypperlig tv-serie, og det skal etter planen produseres to sesonger til. 
Takk og pris 
",1
"Sherlock S01
Rare engelskmenn løser krimgåter 

PREMIERE 
- 24.1 - NRK1 - 21:30 

Aller først må jeg skrive at Sherlock ikke på noen måte en serie om Sherlock Holmes slik den som har lest bøkene kjenner ham. 
Da er Downey Jrs Sherlock Holmes til og med nærmere, siden den i det minste foregår på 1800-tallet. 

Kriminelt geni 

Sherlock handler om en ung mann i dagens London som er så ekstremt god på å løse kriminalgåter at han blir hentet inn når politiet står fast. 

Han er ekstremt rar, ingen rundt ham skjønner seg på ham, men han har respekt blant folk for sine evner. 
Han heter Sherlock Holmes, og han vet alt om deg ved første øyekast. 

Holmes bruker dagens teknologi og oversensitive evner til å observere og gjøre antagelser. 
Han hater stort sett andre mennesker, men liker å ha med legen og eks-Afghanistansoldaten Watson i etterforskningen for å få et friskt perspektiv iblant. 
De to kommer ved en tilfeldighet til å dele leilighet i begynnelsen av serien, og der begynner også starten på samarbeidet. 

Den enkle og den avanserte 

Holmes spilles av Benedict Cumberbatch og Watson spilles av Martin Freeman. 
Begge passer fint i rollene. 

Cumberbatch overrasket meg i rollen som Holmes siden han har et såpass distinkt utseende, men det slår meg mens jeg ser serien at en Sherlock Holmes i all sin eksentrisitet like godt kan se litt snål ut. 

Freemans Watson er en vanlig mann, enkel men stilig, utilpass men bestemt. 

Pilotepisoden av Sherlock bruker sms og elektronisk tekst for alt det er verdt i etterforskningen, andre episode handler om et kinesisk forbrytersyndikat, smugling og tagging mens tredje episode er en katt-og-mus-lek som slutter med en såkalt cliffhanger. 
Gjennomgående er det mye taxikjøring, mørke gater og lokaler og lange monologer fra Holmes som etterlater alle i rommet med måpende ansikter. 

Sykt mye stryk 

Foto og klipp er virkelig forseggjort; Herlig skarpe bilder, ivrig klippet. 
Jeg lurer på om BBC her har brukt RED-kameraet igjen, siden jeg opplever bildet nesten like skarpt som BBCs Wallander. 

Musikken kunne godt vært brukt litt mer forsiktig, da. 
Jeg skjønner at det er vanskelig å komme unna strykerne på en Sherlock Holmes-produksjon, men serien foregår tross alt på totusentallet. 

En serie om eksentrisitet 

Holmes er ikke en type jeg blir kjent med, og det er heller ikke Watson. 
De er for fjerne begge to, men det er nettopp derfor de klarer å løse det ingen andre klarer å løse. 

Første del av Sherlock er å regne som en litt langdryg forrett, egentlig. 
Andre del kommer til sommeren, og da kommer jeg forhåpentligvis litt mer under huden på Holmes og Watson. 

OPPDATERING 
24.1: NRK sender sesong én og to av Sherlock fra og med i kveld, og denne anmeldelsen er basert på sesong én. 
Jeg kommer tilbake med anmeldelse av sesong to så snart jeg har fått sett meg opp. 
Har du sett sesong to, sier du? 
Ja men, så legg igjen ditt inntrykk i kommentarfeltet da! 

Sherlock er å få kjøpt på dvd fra og med 29.mars 2011. 
Se trailer av Sherlock her: 
",1
"Ta den ring
Inneholder alt en sci-fi-thriller trenger 

Ta den ring var Jon Bing og Tor Åge Bringsværds andre sci-fi-serie etter Blindpassasjer. 
Fra den snedige og klaustrofobiske skildringen av stjerneskipet Marco Polo i 1978 fant sci-fi-duoen veien tilbake til jorden igjen i 1982. 
Nærmere bestemt til Oslo og etterhvert Trondheim. 

(trykk på bildet øverst for å se første episode) 

Felles inspirasjon 

Ta den ring er historien om den selvsikre og verdensvante norsk-italienske professoren Roland Marco (Kai Remlov) som besøker Oslo for å delta på en kongress. 

Etter at to personer dør under kongressen går det opp for Marco at han kanskje sitter med nøkkelen til å løse mysteriet, og han stikker til Trondheim for å nøste opp trådene. 

Svaret på mysteriet er en hvilken som helst sci-fi-serie verdig, og jeg mistenker at Bing og Bringsværd og manusforfatterene til den aktuelle NBC-serien The Event har lest samme inspirasjonslitteratur. 

Dette er åttitallet 

Førsteinntrykket mitt er at Ta den ring er helt på høyde med Derrick i å skildre tidsånden. 
Kai Remlow går for eksempel rundt med verdens kuleste klær, og svenske Lena Bergquist kunne vært med i ABBA på alle slags måter. 
Bilene, kommunikasjonsmetodene, sjargongen: dette er åttitallet, hvis du tør å møte det igjen. 

Det er dessuten spennende å se hvordan en sånn serie blir løst her oppe i nord. 
For den inneholder alle elementene en sci-fi-thriller trenger: en hemmelig orden, mystisk teknologi, historisk perspektiv og romanse. 
Men den føles absolutt ikke som noen slik serie. 
Og det er ikke en dårlig ting, heller. 

Nest etter den påfallende åttitallsinnpakningen er det først og fremst tempoet som utgjør den mest merkbare forskjellen på Ta den ring og nyere serier. 

Satt på spissen kunne alle tre episodene blitt fortalt på én episode i dagens tempo, men det er samtidig noe veldig sjarmerende ved denne fortellerteknikken. 

Overraskende holdbar 

At skurkene er svenske, er for eksempel et komisk element i Ta den ring. 
Svensk er kanskje det språket som høres minst skummelt ut her i verden. 

Og at deler av mysteriet løses ved allsang av barnesangen 
Ta den ring på et hotellrom, hører også til i den komiske kategorien. 

Men jeg får aldri noen pinlig komisk følelse, serien holder komikken trygt innenfor rammene av sci-fi-thrilleren og er overraskende holdbar jevnt over. 

Konspirasjonsteori #1 

Med dagens serievante øyne er riktignok ikke Ta den ring mye til thriller, da. 
Jeg holdes ikke på noen som helst måte på nåler, selv om jeg lurer noe aldeles grenseløst på hva i alle dager det er slags installasjon jeg iblant ser klipp ifra. 
Dét skal Bringsværd og Bing ha: de slo på den store tromma for tretti år siden. 

Jeg vil ikke avsløre noen ting, men omstendighetene er omfattende på en slags Erich von Däniken-måte. 

Nasjonalhelt 

Spesialeffektene er enkle, men effektive. 
Ivo Caprino står bak, og han har gjort det han kan best med småskalamodeller. 

Pluss en fet avslutningssekvens som ikke trenger å skjemmes for noe som helst. 
Caprino altså...en nasjonalhelt på høyde med Heyerdahl. 

Ta den ring holder seg overraskende godt, og jeg anbefaler deg å sette av drøye to timer til å få sett alle tre episodene i påska. 
Som en slags hyggelig, norsk motvekt til all ""en ung kvinne blir meldt savnet""-krimmen som går hver bidige kveld ellers. 

Se alle episodene i nett-tv her: 

Bør Norge (og NRK) lage mer sci-fi? 
Legg inn din kommentar under. 
",1
