text,label
"Lite moro for penga
Pink: 
Funhouse 

En såret Pink leverer sitt hittil dårligste album. 

Pink har i forkant av sitt femte album Funhouse lovet at det skulle bli hennes mest sårbare til nå, hvilket langt fra lovet godt. 
Én ting er å høre verdensstjerners dundrende radiohits, som i noen tilfeller kan nytes for sin høyrøstede umiddelbarhet; en annen er å måtte høre gnål om ekteskapsbrudd (hun skilte seg nylig fra motrocross-ektemannen Carey Hart) i form av forutsigbare ballader. 
Det er aldri gøy. 

Heldigvis preger ikke balladene platen så mye som først fryktet. 
Pink er proff og har i samarbeid med sitt produsentteam også rotet sammen en mengde radiovennlige opptempo-affærer, hvorav førstesingel ”So What” har gjort stor suksess på eteren i flere land, med god nok grunn. 

Med det sagt: 
Funhouse er en selsom, anmasende og uinspirert opplevelse. 
Den nå 29 år gamle Hollywood-baserte entertaineren har alltid prøvd å fremstå som den tøffeste i klassen – lettere bifil og flink til å vise fingeren på pressebilder – men det er en obsternasighet like gjennomsiktig som en rull plastfolie. 

Det er mye å kritisere her, det være seg det Ting Tings-på-valium-aktige tittelsporet, den sutrende leirbål-sviska ”Crystal Ball”, sidrumpa ”Please Don't Leave Me” eller pianoklimprende ”Glitter In The Air"". 
Levelige innslag inkluderer den emosjonelle og orkestrale ”One Foot Wrong” samt det pumpende og elektriske avslutningssporet ”This Is How It Goes Down”. 
Det hjelper lite når resten av materialet gir meg lyst til å legge meg og aldri stå opp igjen. 
En plate for dynga. 
",0
"Effektsirkus
T-Pain: 
Thr33 Ringz 

Advarsel: 
Thr33 Ringz inneholder overdreven bruk av autotune! 

Den amerikanske kjekkasen T-Pain, aka Faheem Rasheed Najim, bygde om gutterommet til studio som tiåring og har de siste åra gjort seg bemerket som både soloartist og produsent, i tillegg til hyppige gjesteopptredener hos andre storheter som Flo Rida, Akon og Kanye West. 

På sitt tredje soloalbum går T-Pain inn i rollen som sikrusdirektør med et stjernelag av gjesteartister i manesjen. 
Drøye to minutter ut i ""Chopped & Skrewed"" dukker Ludacris opp med et relativt forfriskende vers, mens T-Pain følger opp med mer monoton sang. 
Det ryddes plass til en tilbakelent og langt fra hardslående Kanye West i ""Therapy"", og låta blir nok et bevis på at West kanskje er en anelse oppskrytt. 
Lil Wayne avlegger 
I Can`t Belive 
It en snarvisitt, men heller ikke den karen kan karakteriseres som noen redningsskøyte. 
T-Pain er på dypt vann og drukner i sitt eget bruk av akk-så-banale effekter. 

Thr33 Ringz kan anses som et konseptalbum der hovedingrediensene er, foruten de nevnte gjestene og flere, humor og autotune. 
Det humoristiske kommer først og fremt til uttrykk gjennom snurrige tekstlinjer og skits, brorparten med innhold relatert til en fiktiv sirkushverdag. 
Det plapres mye bullshit mellom slaga, og det er slett ikke alt som er like morsomt. 

Og så var det T-Pains kjennemerke numero uno, da, autotune. 
Denne enerverende effekten ser ut til å bre seg over sjangeren som svartedauen på 1300-tallet. 
Den kan sikkert ha noe for seg i ny og ne, men gjennom så godt som samtlige nitten spor på Thr33 Ringz er det utilgivelig, hensynsløst og i stand til å ødelegge det lille som var av gode lytteropplevselser på dette albumet. 
",0
"Skinndød lyd
The Dudes: Brain, Heart, Guitar 

Gir anonym FM-rock nok et blekt ansikt utad. 

Det er imponerende hvor identitetsløse gitarband kan høres ut dersom de virkelig forsøker. 
The Dudes er en ny favoritt i så måte, der de på perfekt vis klarer å finne det kjedeligste ved Jet, The Script og Maroon 5, og sette det sammen til et album som levner lytteren ute av stand til å føle noe som helst. 

Brain, Heart, Guitar ble opprinnelig sluppet i 2006, og hvorfor noen skulle ta seg bryet med å få det distribuert i Europa skjønner jeg ikke. 
Det hadde holdt lenge å sendt noen eksemplarer til utvalgte mobiloperatører, for det er her kanadiernes målgruppe holder til; dette er TV-reklamerockens nye, skummetmelkfargede fanebærere. 

Nestenmelodier forenes med daffe nødrim og en vokalist som legger seg såpass opp mot Dave Matthews at det kiler i drøvelen. 
Dette kjøres sammen til en lydgrøt som smaker omtrent like godt som bløt papp, og bør unngås av alle som ikke jobber i reklamebyrået til Vodafone. 
",0
"Pop uten sjarmpoeng
Those Dancing Days: 
In Our Space Hero Suits 

Det er ikke gull alt som klimprer, og Those Dancing Days er representanter for den delen av Døgnflue-Sverige som aldri kommer ut av startgropen. 

Den svenske tweepop-scenen er full av nydelige små band, til den grad at den ivrige tilhenger av slikt noe er svært godt vant om dagen. 
Those Dancing Days er imidlertid ikke blant disse, til det er dette debutalbumet altfor bleksottig, humørløst og uspennende. 

Vokalist Linnea Jönsson finner seg aldri til rette i det synthdrevne sekstitallspoplydbildet jentene har skapt seg; stemmen hennes er hverken god eller karismatisk nok til å drive låtene. 
Når melodiene i seg selv er frustrerende uappellerende er det lite som biter seg fast hos lytteren, og man sitter mest og irriterer seg over at synthen spiser opp riffene snarere enn å skape eller underbygge dem. 

In Our Space Hero Suits er glemt før den engang rekker å bli ferdigspilt, og dersom du på død og liv skal kjøpe en tweepopplate denne uken, gå mye heller for norske Je Suis Animals utgivelse fra fjoråret. 
",0
"Grått på horisonten
Vår anmelder Marius Asp slakter U2s nye plate No Line On The Horizon. 

U2: 
No Line 
On The Horizon 

Lyden av et band som krakelerer under vekten av sin egen historie. 

Det er ikke enkelt å være Verdens Største Og Viktigste Band, men det er fortsatt der U2 befinner seg, etter drøyt 30 år i gamet. 
De er elsket av mange, men hatet – med en nærmest pubertal iver – av minst like mange andre, ikke minst takket være Bonos selvrettferdige og pompøse offentlige profil. 

Der de to foregående utgivelsene mest av alt fremsto som reinspikka retroløp – solide, men forholdsvis uinteressante og utspekulerte rekonstruksjoner av strategiene bak suksesser som The Joshua Tree og Achtung Baby – har den irske kvartetten brukt hele fem år på å følge opp How To Dismantle An Atom Bomb, og dessuten gått langt i å antyde at de atter en gang har gitt U2-merkevaren et etterlengtet påfyll av relevans og innhold. 

U2 er imidlertid, som de fleste andre tradisjonelle rockeband, avhengig av minneverdige sanger for å skinne. 
De er i et mindretall på No Line On The Horizon. 
Førstesingelen ”Get On Your Boots” høres ut som en forkastet demo fra Pop-innspillingen, og står som et grusomt eksempel på hvor slapt dette bandet er i stand til å låte når låtmaterialet ikke sitter. 
""Stand Up Comedy"" er hvitmannsfunk på sitt mest sidræva, mens den nittitallsduvende ""Moment Of Surrender"" skjemmes av Bonos slitne stemmebånd og en spillelengde langt utover det forsvarlige. 

Det er likevel fraværet av enkeltstående gull som er det mest slående ved albumet. 
Låter som tittelsporet, ""Fez - Being Born"", ""White As Snow"" og ""Cedars Of Lebanon"" er på ingen måte støtende dårlige, kun pregløse, grå og uvanlig ukarismatiske. 
""Unknown Caller"" og ""I'll Go Crazy If I Don't Go Crazy Tonight"" er små lyspunkter, men helhetlig må No Line On The Horizon betraktes som en tonesettelsen av en identitetskrise i et band som for alvor begynner å bli for selvbevisste for sitt eget beste. 

Slik sett minner skiva om både Zooropa og Pop, men de var i det minste interessante og modige steg videre - om enn tidvis i feil retning. 
Dette er bare trist og kjedelig, og et av U2s desidert svakeste album hittil. 
",0
"Mellom alle stoler
Chris Cornell: 
Scream 

Det er slett ikke uvanlig at menn (og kvinner også, for den saks skyld) går inn i en form for krise ved passerte 40. 
Noen kjøper Harley, andre stikker kjønnet sitt inn i langt yngre kvinner, mens Chris Cornell ringer Timbaland og ber om noe kult som kidsa kan like. 
Dette albumer oser av overgangsalder og viser at Cornell er en fallen stjerne. 

Det som i utgangspunktet skulle være gamle låter remikset av Timbaland, har resultert i albumet Scream - snekret sammen på rekordtid, noe det i aller høyeste grad bærer preg av. 
Her måkes det på med klassiske Timbo-elementer som håndklapp, programmerte trommebeats og velkjente gitarriff. 
Timbaland har jo nattbordskuffet full av resirkulerte effekter og en sampler det meste går igjennom. 
Mye av dette har vi hørt før, tydeligst på Bubba Sparxx' Timbaland-produserte Deliverance, men også hos andre artister som N.E.R.D. og Gnarls Barkley. 

Naturlig nok har albumets lydbilde et tydeligere hiphop- og r&b-tilsnitt enn hos hovedpersonens to tidligere soloutgivelser. 
Og dette bakteppet virker på grensen til uforenlig med Cornells vokal - den er, som alltid, heseblesende, kraftfull og rocka. 

Det er vanskelig å se for seg hvem dette albumet er tilegnet. 
Timbaland-tilhengere og den unge søkende lyttergarde, som jeg mistenker at Cornell prøver å nå, vil dette av lasset og syns det er for dvaskt og lite spenstig, mens gamle Audioslave- og Soundgarden-fans vil vri seg i Converse-skoa mens rødfragen brer seg over ansiktsgrimasene. 

Det er ikke gitt at rockevokal og hiphop-beats fungerer, og skal det funke må det kombineres på en langt snedigere måte enn her. 
Scream er gjennomgående lite raffinert og en sann utfordring å høre på uten å benytte pauseknappen gjentatte ganger. 
Samarbeidet Cornell/Timbaland var en tidvis besværende tanke, men det er lang vei fra idé til gjennomføring. 
En flau affære. 
",0
"Raker mæ'kke
The Rakes: 
Klang 

Snertent britisk band som fremprovoserer en trang til å oppsøke låtskriveren og denge ham på pungen med en kald øse. 

Dere vet nøyaktig hvordan The Rakes høres ut: 
1/3 fuzzgitarer spilt med overstram gitarreim, 1/3 tekster om vunnet/tapt kjærlighet i fylla, og den siste tredelen fylles av bandet selv; en intenst Marlboro-siggende, manisk blidspent gjeng fra en middelklasse-minus-oppvekst i en småstor engelsk by. 

Den ørkesløst skjematiske tilnærmingen til poprock med den tilhørende stillstanden som har slått ut britpopen ivaretas på utmerket vis på Klang; her manifestert ved singelen ”1989”: 

Alt The Rakes foretar seg her blir utført med en innlevelse som kan sammenlignes med å sutte på en skitten oppvaskklut, og det virker da heller ikke som om bandet selv bryr seg det kvakk om sin egen musikk. 

Låttitler som ”Bitchin’ In The Kitchin”, ”The Light From Your Mac” og “The Loneliness Of The Outdoor Smoker” er inngangsportaler til en verden av kjøleskapsmagnetpoesi åpenbart forfattet to-tre minutter før studioleien begynte å tikke. 
Melodier og tekster forsøker å overgå hverandre i selvfølgeligheter, til man til slutt sitter med en musikalsk velling som er røykelungegrå, lunken og fullstendig uten smak. 

Sett på Klang og denne her etter hverandre, og du har en kveld som kan gjøre en hver pasifist til krigshisser. 
",0
"Mira-maraton
Mira Craig: 
Ghetto Fairytale 

På sin tredje albumutgivelse er Mira Craig i ferd med å bli en parodi på seg selv. 

Det er all grunn til å applaudere unge kvinnelige musikere som ønsker full kontroll over eget musikalsk materiale. 
Vi har gjennom vårens avisoppslag skjønt at Mira er en sånn kvinne. 
Selvstendig, bestemt og kompromissløs. 
Flott! 
Men, det er ikke alltid så dumt å lytte til- og få hjelp fra - andre enn seg selv. 
At Mira (nok en gang) har hatt sine fingre med i hele spillet og dermed også gapt over for mye er den største svakheten på Ghetto Fairytale. 
Svakhetene er sågar mange. 

Show, don't tell, Mira. 
Hvis du er den uovervinnelige verdensmesteren du i tekstene begir deg ut for å være, så fleks dine musikalske muskler. 
Host opp musikk som slår meg i bakken, gi meg noen hardtslående beats og fengende melodier. 
Særlig hva gjelder det lyriske savner jeg større variasjon og modenhet. 
I mindre doser kunne det vært smigrende med oppmuntringer av typen ""tro på deg selv"", ""ikke finn deg i å bli urettferdig behandlet"", ""du kan få til det du vil"", osv. 
Men når det er gjennomgående på Ghetto Fairytale, oppleves det som utvaska klisjéer og dvaske visdomsord som mest av alt minner om ting jeg ble fortalt på konfirmasjonsleir. 

Det holder ikke med et fiffig eventyrlig tilsnitt, som låtene ""Find The Key"" og ""Ghetto Fairytale"" er gode eksempler på. 
Der er lydbildet skumringsmørkt, med musikalsk produsentkrydder som fløyte, synth og piano. 
Koringene er mange og pompøse og som lytter veksler jeg mellom å være flau og nesten-imponert. 
For det er på grensen til imponerende når vokalisten Mira er på sitt beste. 
På ""Smile"" er det befriende behagelig at hun roer ned gneldringa, og når Miras eventyrlige maraton avsluttes med ""Shine"" blir vi minnet på hvor særegen og stødig vokalen faktisk kan være. 

Kult er det også når Mira gjør det som i stor grad har vært forbeholdt menn, nemlig å synge om å bli tilfredsstilt med nasty sex i ""Nasty Cut"". 
Med basstunge beats og frekk vokalfremføring blir dette albumets høydepunkt. 
Bare så synd det ikke var flere av dem denne gangen. 
",0
"Tom arena
Tzars: 
Tzars 

Minste-felles-multiplum-rock i skrikende manko på egenart. 

Den Oslo-baserte trioen Orango har fått med seg vokalist Vegard Mordal og blitt til Tzars, som med sitt selvtitulerte debutalbum kaster seg inn den relativt harde kampen om å bli spilt på norsk rockeradio. 
Slik låter i alle fall disse ti låtene – solid, gitartung, stadionformatert indierock svøpt i det seine nittitallets alvorstunge zeitgeist. 

Problemet tilkjennegis umiddelbart: 
Vi har hørt dette før, enkelt og greit (og da tenker jeg ikke bare på bandets resirkulering av Orango-låten ”This Love Is Murder”). 
Kvartetten opererer strengt innenfor et terrenget der hitjegere som a-ha, U2, Kent og The Killers lusker i de melodiske buskene og The Music og lignende britiske middelmådigheter har definert lydbildet, uten at de makter å forvalte sjangeren med originalitet eller egenrådighet. 

Tzars er verken provoserende eller direkte dårlig, til det er det for mange drevne aktører innblandet – ikke minst powerpop-kapasiteten Kenneth Ishak, hvis bidrag som produsent og musiker på albumet ikke utgjør noen som helst betydning i verken positiv eller negativ retning. 
Jeg kan bare ikke i mine villeste fantasier forestille meg hvem som trenger denne musikken – i det minste ikke når den allerede fem år gamle ”Somebody Told Me” kan lastes ned for åtte kroner i en nettbutikk nær deg. 
",0
"Elektrokluss
Fischerspooner: 
Entertainment 

Elektroduo med beina godt plantet i fordøyet mat. 

Fra den støvete hylla for electroclash, en sjanger fra tidlig 2000-tall som blandet Lego-briller og Kraftwerk, har ”pionerene” i Fischerspooner falt pladask ned med et album omtrent fullstendig blottet for kvalitet. 
Litt humor har New York-duoen riktignok unnet oss med singelen ”Danse en France”, der vokalist og homoflørten Casey Spooner med sin begrensede stemmeprakt gir oss franske skolegloser i arbitrær rekkefølge. 
Morsomt, men ikke spesielt bra. 

Noe oppjazza 80-tallssynth her og en og annen 128bpm-beat der er grunnlaget for de blasse låtene og rådville hookene Fischerspooner serverer på sitt tredje album, et album med misvisende tittel. 
Vi er kanskje blitt bortskjemte med Pet Shop Boys og deres unike meloditeft, eller Röyksopps lekre produksjon og treffsikre vokalbidrag, men Fischerspooner gjør ikke annet enn å minne om hvilke enorme fallgruver elektrosjangeren inviterer til. 

Kanskje vil slitne bytryner bevege de spisse skoene sine til låter som ”We Are Electric”, men som helhet holder ikke Entertainment verken vann eller vår tålmodighet. 

Live skal Fischerspooner ha for å være vitale og småkaute. 
Med ekstremt velkoreograferte dansere og en nyskapende dramaturgi og sceneshow, gjør de gull av gammel gråstein. 
Det er da vi minnes om hvilken impact de hadde med singelen ”Emerge” en gang for lenge, lenge siden. 
Slik sett vil de kanskje kunne overleve i et marked preget av fallende platesalg, men det hjelper veldig lite når varsellampen for ”hørt-det-før” blinker i takt med mobiltelefonens manglende-batteri-melding. 
",0
"Parken har parkert
Maxïmo Park: 
Quicken The Heart 

Det har gått noen år siden Maxïmo Park var frekkest i bråkepopgaten, og to album etter debuten er de bitre og idétomme. 

Britenes fire år gamle debutalbum A Certain Trigger, det første indierockalbumet som ble sluppet på den eksentriske elektronika-etiketten Warp, kom lastet med tøffe, voldsomt fengende singler som i særdeleshet ""Graffiti"" og ""Apply Some Pressure"". 
Etterpå har det vært langt mellom de gode låtene, og både Our Earthly Pleasures og Quicken The Heart lider kritisk under akkurat dette. 
Her i form av den ferske singelen ""The Kids Are Sick Again"": 

Albumet bærer preg av en gjennomgående mangel på melodisk selvtillit, og ethvert forsøk på snert føles bare som et lett dask med en våt brøddeig. 
De spretne leddene til vokalist Paul Smith virker å ha fått gikt, og han fremfører uten innlevelse. 
""Nothing to look forward to"", synger han i singelen, og det virker som om dette har slått rot i hele Maxïmo Parks fremtoning. 

Quicken The Heart er lyden av et band som desperat forsøker å holde sitt spenstige og kantede image ved like, selv om de godt vet at låtene ikke holder mål. 
Det er lenge siden Maxïmo Park var lyttverdige, og akkurat nå er det lite som tilsier at de vil bli det igjen. 
",0
"Funk off!
Side Brok: 
Ekte Menn 

Funken styrer Side Brok nedenom og hjem. 

Da Side Brok debuterte i '03 med Høge Brelle, og fikk en nesten-hit med låta ""1-2-3-fyre"" var det mange som ropte om ""friskt pust"", ""alternativt"" og ikke minst ""artig"". 
Personlig falt jeg aldri helt for debuten (eller oppfølgeren) til sunnmøringene, mest fordi jeg aldri skjønte om Side Brok var et seriøst musikalsk prosjekt eller en nachspiel-idé som hadde gått for langt. 
Dersom noen rettmessig skulle sitte på patentet til den noe udefinerbare sjangeren ""dialektrap"" ville allikevel Side Brok være et åpenbart valg. 

Siden sist er de blitt et par hakk mer soul- og funkbasert enn tidligere, og der sunnmøringene tidligere hadde en viss elektronisk tilnærming til sine egne låter går det stort sett i uinteressant voksen-funk denne gangen. 
El-orgler, organiske trommer, snille gitarer, myk bass og en og annen synth. 
Oooh-ing her og aaah-ing, der. 
Uten at det løfter låtene, for å si det pent. 
Bortsett fra ""Ord for dagen – derpå"" og ""Drit å gjer"" (som begge innehar et visst potensiale) samt slitsomme ""Pow Wow"" klarer Ekte Menn aldri å fri seg fra det klamme, litt kvalmende lydbildet en finner igjen på en middels Smuget-konsert. 
Hvis du lukker øynene når albumet er på sitt minst tiltalende (""Skjemde""), kan du formelig se for deg et forholdsvis bedritent folkehøyskoleband forsøke å gjenskape Montées demoer til Isle of Now. 
Ubehagelig. 

Hva selve rappinga angår er det ikke stort å melde siden sist, verken hva angår flows og stemmebruk. 
Sjeldent er Torstein 
Hyl det største problemet ved låtene, sjeldent løfter han de særlig. 
Stort sett er han en rapper som melder ganske hverdagslige, intetsigende ting på en ganske intetsigende måte. 
Du skal jobbe hardt for å suges inn i det trivielle tekstuniverset, for å si det slik, selv om herr 
Hyl nå og da er småvittig, og har en og annen god observasjon godt gjemt der inne. 

Heldigvis er ikke norsk rap på en annen dialekt enn østlandsk særlig oppsiktsvekkende mer, og heldigvis har norsk hip hop har tatt såpass store steg at framover at Side Brok ikke lenger er noe reelt alternativ til noe som helst. 
Hvis ikke hadde det nemlig stått fryktelig dårlig til. 
",0
"Sataniske Vers
Erik og Kriss får hard medfart av vår anmelder 

Erik 
Og Kriss: 
Tabu 

Banalitetens voktere er tilbake. 
Mer forslitte og hjelpesløse enn noengang. 

Så, hva er annerledes siden vi sist hørte noe fra gladgutta fra Bærum? 
Vel. 
Tabu er hakket mer organisk enn Verden Vil Bedras, og med visse variasjoner og forbedringer hva angår flow og stemmebruk. 
Muligens har gutta lagt litt arbeid ned i å gjøre rappinga bedre, og det er vel bare rett og rimelig å nevne at det faktisk høres her og der. 

Hva har ikke forandret seg siden sist? 
Det meste annet. 
Tabu er nemlig, som Verden Vil Bedras, strengt tatt lite annet enn en tilfeldig samlet rekkefølge av fullstendig verdiløse låter. 

Det mest slående er guttas fullstendige mangel på egenskaper som teksforfattere, som faktisk er hakket verre enn sist. 
Om mulig. 
Flesteparten av albumets tekster er i beste fall håpløst banale (selv til norsk rap å være), i verste fall direkte grusomme. 
Det florerer i (svært lite poetiske) poetiske omskrivninger, platte tekstlinjer basert på ordtak og klisjeer, elendige punchlines og uinteressante, til tider svært generelle hverdagsbetraktninger. 
At noen som vil leve av det norske språket skriver så ufattelig dårlig må vel kunne kalles ambisiøse, for å si det pent. 

La oss eksempelvis ta for oss fjerdesporet «Borte Bra» - sannsynligvis den kjedeligste og minst velskrevne teksten lagt på en norsk rap-skive noensinne; ""Nå med eget sted å bo/har jo leid i fem år snart/nesten ikke til å tro/de sier borte er bra, men hjemme er visst bedre/og med flere hjem lar livet seg lettere leve"". 
Legg til en produksjon drevet av kassegitar og overkommuniserende synth-føleri og du har et musikalsk vakuum i hende. 

""Rundt Fingeren"" minner mest om en damenes tale hentet fra et juleball i første gym., hvor den oppbrukte ""jenter bruker så lang tid på badet, men jaggu er vi ikke glad i dem likevel""-klisjeen brettes ut til det pinlige over nok en leirbål-klimprende, motstandløs gitarproduksjon. 
Kor-refrenget i ""Hverdagshelt"" (forøvrig basert på nok en eksepsjonell triviell betraktning om hyggelige folk som hjelper dem å flytte og pusse opp o.l.), er så overkill at dersom dette hadde vært mitt første møte med Erik Og Kriss ville jeg trodd det var en parodi, eller gjort på kødd. 

Det er det altså (sannsynligvis) ikke. 
Låter som ""Du 
Og Jeg"" med linjer som ""jeg skulle løfta deg som du kunne sveve/svingt deg rundt/tatt deg imot i min neve"" gjør ikke ståa bedre, og den teite naturalistiske storytellingteksten om en megler som dør i Slottsparken på (platas beste spor rent produksjonsmessig) ""Slår Sprekker"", er legendarisk dårlig. 
Distingverthet, antydningens kunst, fintfølelse? 
Ikke det, nei. 
Talende nok blir ikke Tabu engang ufrivillig festlig i slike stunder. 
Istedet høres det hele bare ut som en tafatt blanding av trist og kynisk, stusselig og utspekulert, og ikke minst kjedelig. 

La oss være frekke nok til å kalle tittellåta et nøkkelkutt, og gå i dialog med den. 
Her påstår Erik Og Kriss at de er like tabu ""som en homofil prest"" (jaha? 
Finnes det ikke flust av de?), fordi det er feil for slike som meg ""å like det alle liker"". 
De påstår at grunnen til at de får dårlige karakter av anmeldere er et utslag av elitisme, og at Erik og Kriss er som Pizza Grandiosa – hatet av kritikerne, men elsket av folket. 
Vel. 
Å være elsket av folket er vel en mild overdrivelse for en gruppe som tross alt ikke er nær MadCon, Alexander Rybak eller Ole Ivars i salgstall og popularitet. 
Å deretter hevde at denne påståtte folkets elsk er grunnen til at de ikke er godt likt blant anmeldere og det generelle hip-hop-publikummet, er strengt tatt feil vekting av årsaksforhold. 

Grunnen til at de ikke likes av folk som liker musikk, bunner ned til et eneste aspekt: – mangelen på egenskapene de besitter: som tekstforfattere, låtskrivere og produsenter. 
Så enkelt kan det altså være. 
",0
